<?xml version="1.0" encoding="UTF-8"?>
<!DOCTYPE R SYSTEM "./ej1.dtd" >
<R>
  <D/>
  <E>
    <E>
      <A/>
      <A/>
    </E>
    <E>
      <A/>
      <A/>
    </E>
  </E>
</R>
